{
  "dataset_version": "0.1.0",
  "type": "nec_expected_changelog",
  "cycle": "2017-to-2020",
  "sources": [
    {
      "source_id": "synthetic-first-draft",
      "document_type": "first_draft_report",
      "title": "Synthetic First Draft record",
      "cycle": "2017-to-2020",
      "source_url": "https://example.test/first-draft.pdf",
      "retrieved_at": "2026-08-02T13:30:00Z",
      "sha256": "1111111111111111111111111111111111111111111111111111111111111111",
      "media_type": "application/pdf",
      "access_scope": "synthetic-public",
      "panel": "CMP-02",
      "page_count": 12
    },
    {
      "source_id": "synthetic-second-draft",
      "document_type": "second_draft_report",
      "title": "Synthetic Second Draft record",
      "cycle": "2017-to-2020",
      "source_url": "https://example.test/second-draft.pdf",
      "retrieved_at": "2026-08-02T13:31:00Z",
      "sha256": "2222222222222222222222222222222222222222222222222222222222222222",
      "media_type": "application/pdf",
      "access_scope": "synthetic-public",
      "panel": "CMP-02",
      "page_count": 18
    },
    {
      "source_id": "synthetic-standards-council",
      "document_type": "standards_council_decision",
      "title": "Synthetic Standards Council record",
      "cycle": "2017-to-2020",
      "source_url": "https://example.test/council.pdf",
      "retrieved_at": "2026-08-02T13:32:00Z",
      "sha256": "3333333333333333333333333333333333333333333333333333333333333333",
      "media_type": "application/pdf",
      "access_scope": "synthetic-public",
      "panel": "CMP-02",
      "page_count": 4
    }
  ],
  "expected_changes": [
    {
      "expectation_id": "exp:synthetic-add",
      "change_chain_id": "synthetic-add",
      "from_locators": ["210.8"],
      "expected_target_references": ["210.8(F)"],
      "unresolved_references": [],
      "change_types": ["add_subdivision"],
      "summary": "Synthetic issued addition expectation.",
      "disposition": "change_expected",
      "confidence": "high",
      "controlling_record_id": "SC-add",
      "supporting_record_ids": ["FR-add", "SC-add"]
    },
    {
      "expectation_id": "exp:synthetic-no-change",
      "change_chain_id": "synthetic-no-change",
      "from_locators": [
        "210.8(A)(1)",
        "210.8(A)(2)",
        "210.8(A)(3)",
        "210.8(A)(4)",
        "210.8(A)(5)"
      ],
      "expected_target_references": ["210.8(A)"],
      "unresolved_references": [],
      "change_types": ["no_final_change"],
      "summary": "Synthetic return to prior-edition expectation.",
      "disposition": "no_change_expected",
      "confidence": "medium",
      "controlling_record_id": "SR-no-change",
      "supporting_record_ids": ["FR-no-change", "SR-no-change"]
    }
  ],
  "observed_changes": [
    {
      "observed_change_id": "obs-add",
      "from_locators": ["210.8"],
      "to_locators": ["210.8(F)"],
      "change_types": ["add_subdivision"],
      "summary": "Synthetic observed addition.",
      "alignment_confidence": 0.98
    }
  ],
  "reconciliations": [
    {
      "reconciliation_id": "rec:synthetic-add",
      "expectation_id": "exp:synthetic-add",
      "observed_change_ids": ["obs-add"],
      "outcome": "confirmed",
      "message": "The observed edition diff confirms the expected change."
    },
    {
      "reconciliation_id": "rec:synthetic-no-change",
      "expectation_id": "exp:synthetic-no-change",
      "observed_change_ids": [],
      "outcome": "confirmed",
      "message": "No change was observed, consistent with the negative expectation."
    }
  ],
  "diagnostics": []
}
